X,Y,OBJECTID,REQUESTAPPROVALSTATUS,REQUESTCOMPLETEDNOTE,REQUESTTYPENOTE,DATESUBMITTED,ADDRESS_OR_LOCATION_OF_CALL,ADDRESS,SD,SPA,CITY,LESSTHAN5PEH,POSSIBLEDWELLERS,COLLABORATORDATEAVAILABILITY,REQUESTCOMPLETEDSTATUS,AMOUNTDEBRISREMOVEDINT,REQUESTCOMPLETEDDATE,GLOBALID
-118.179575321277,34.0200278126859,3773,Request Completed,10/30/25,Non-Displacement,2025/10/09 19:05:00+00,"4311 Telegraph Road, Los Angeles, CA, 90023",Telegraph rd from Downey rd to South Brannick ave,1,SPA 7,Unincorporated - East Los Angeles,yes,2,2025/10/30 15:37:00+00,yes,0,2025/10/30 19:00:00+00,6c76ab8e-eb6f-40ab-83a8-9a268ca1373d
-118.244368694817,33.9712264202805,3774,Request Completed,12/16/25,Non-Displacement,2025/10/09 19:42:00+00,"1672 East 76th St, Los Angeles, CA",1672 E 76th St,2,SPA 6,Unincorporated - Florence-Firestone,yes,4,2025/12/16 16:00:00+00,yes,40,2025/12/16 20:00:00+00,02047984-064d-4e90-ab56-3cba805fa9ff
-118.158388788052,34.0189280960268,3775,Request Completed,11/13/25,Non-Displacement,2025/10/09 20:08:00+00,"947 South Atlantic Boulevard, Los Angeles, CA, 90022",Alley between S Woods ave and S Atlantic blvd between Verona and Olympic ,1,SPA 7,Unincorporated - East Los Angeles,yes,2,2025/11/11 16:00:00+00,yes,14,2025/11/13 20:00:00+00,127bca44-5d34-410a-b21e-23f99d04b031
-118.232857827193,33.9570775162704,3776,Request Completed,12/16/25,Non-Displacement,2025/10/09 20:49:00+00,"8727 Juniper St, Los Angeles, CA, 90002","8727 Juniper St, PEH under trees. ",2,SPA 6,Unincorporated - Florence-Firestone,yes,2,2025/12/16 16:00:00+00,yes,20,2025/12/16 20:00:00+00,87dfd2c8-5a72-4005-a478-3542a808767b
-118.250829423929,33.9631718570887,3777,Request Completed,12/18/25,Non-Displacement,2025/10/09 20:55:00+00,"1334 East 83rd St, Los Angeles, CA, 90001","1334 E 83rd St, PEH in white truck. ",2,SPA 6,Unincorporated - Florence-Firestone,yes,1,2025/12/16 16:00:00+00,yes,5,2025/12/18 20:00:00+00,5ff5cc40-b496-46ba-84a4-e94a0496918f
-117.889439016678,33.9872314967497,3778,Request Completed,11/14/25,Non-Displacement,2025/10/10 14:55:00+00,"1709 South Nogales St, Rowland Heights, CA, 91748",West side of Nogales south of Colima,1,SPA 3,Unincorporated - Rowland Heights,yes,1,2025/12/02 16:00:00+00,prev_approved_activity_not_required,0,2025/11/14 20:00:00+00,f699f978-29a7-489e-87cb-3fb309126c32
-118.369675797367,34.147269150262,3779,Request Completed,10/23/25,Full Encampment Protocol,2025/10/10 15:13:00+00,"4294 Vineland Avenue, North Hollywood, CA, 91602","Tujunga Central Channel, left (east) bank, downstream (south) of Vineland Ave.",5,SPA 2,Los Angeles - North Hollywood,yes,3,2025/10/23 15:00:00+00,yes,10,2025/10/23 19:00:00+00,bec1b983-127f-4dd3-8fc7-13f4fdcf9e01
-118.410070201667,34.238061869895,3780,Request Completed,10/15/25,Immediate Action,2025/10/10 16:43:00+00,"9300 Laurel Canyon Boulevard, Pacoima, CA, 91331",Project 107 Channel underneath the Laurel Canyon Blvd. bridge. ,3,SPA 2,Los Angeles - Sun Valley,yes,2,2025/10/14 15:00:00+00,prev_approved_activity_not_required,0,2025/10/15 19:00:00+00,88846ea4-14e1-4ac8-b9a7-ecf2f202b3ac
-118.361391780063,34.1438200218423,3781,Request Completed,10/16/25,Immediate Action,2025/10/10 17:46:00+00,"4100 Cahuenga Boulevard, North Hollywood, CA, 91602","L.A. River, left bank, upstream of Cahuenga Blvd. ",5,SPA 2,Los Angeles - Toluca Lake,yes,1,2025/10/15 15:00:00+00,yes,5,2025/10/16 19:00:00+00,7129f38f-af2e-4a5f-a1ce-67bc57300810
-118.291980000309,33.9391583903037,3782,Request Completed,11/18/25,Non-Displacement,2025/10/10 18:55:00+00,"10641 South Vermont Avenue, Los Angeles, CA","10641 S Vermont, PEH on center median & on 107th St. ",2,SPA 8,Unincorporated - Athens-Westmont,no,6,2025/11/18 16:00:00+00,yes,40,2025/11/18 20:00:00+00,7c20845c-bb4e-4f11-a2fe-4b777cdba973
-118.289961716833,33.8396528348625,3783,Request Completed,11/21/25,Non-Displacement,2025/10/10 20:28:00+00,"20933 S Van Deene Ave, Torrance, CA, 90502, USA","PEH on Vermont Ave south of Torrance Blvd north of Javelin St, East side. ",2,SPA 8,Unincorporated - West Carson,yes,1,2025/12/09 16:00:00+00,prev_approved_activity_not_required,0,2025/11/21 20:00:00+00,ea90d7b9-c69f-44cc-8208-00a6e193eaf5
-117.940133521427,34.0365952486443,3784,Request Completed,12/03/25,Non-Displacement,2025/10/10 21:29:00+00,"15823 Amar Road, La Puente, CA, 91744",North side of Amar between Aileron and Echelon ,1,SPA 3,Unincorporated - Valinda,yes,3,2025/12/02 16:00:00+00,yes,1,2025/12/03 20:00:00+00,8c804f38-cca5-41d7-b2f3-e32f9b7e9250
-117.887487265079,33.9978163689384,3785,Request Completed,12/03/25,Non-Displacement,2025/10/10 22:02:00+00,"938 South Nogales St, Rowland Heights, CA, 91748",Located on Front Street,1,SPA 3,Unincorporated - Rowland Heights,yes,2,2025/12/02 16:00:00+00,yes,20,2025/12/03 20:00:00+00,e1ea5759-58e1-49bb-81df-539ba3c27374
-117.904330637835,33.9930695985841,3786,Request Completed,10/17/25,Immediate Action,2025/10/14 16:20:00+00,"1400 Felicia Avenue, Rowland Heights, CA, 91748","*Repeat Maintenance Cleanup*
Encampment and debris in underground portion of Vernon Channel. In danger of storm season flooding. Adjacent to Shopping Center at 1330 Fullerton Rd, also underneath Colima Rd. Previously cleaned on 10/3/25.",1,SPA 3,City of Industry,yes,2,,yes,20,2025/10/17 19:00:00+00,b88fb65e-f804-45d4-8286-4c849c8ca8cc
-118.450492182845,34.0546678472593,3787,Approved by CEO-HI,,Non-Displacement,2025/10/14 18:13:00+00,"1223 South Sepulveda Boulevard Los Angeles, CA, 90073",PEH on west side Sepulveda Blvd south of Wilshire Blvd. ,3,SPA 5,Unincorporated - West LA,yes,1,2026/01/31 04:00:00+00,,,,c691133d-eed2-41e9-a7fd-0a55f6774b13
-118.006968988835,34.1106330290905,3788,Request Completed,02/17/26,Non-Displacement,2025/10/14 18:27:00+00,"4430 East Live Oak Avenue, Arcadia, CA, 91006",Live Oak av just Northeast of Lynd av,5,SPA 3,Unincorporated - Arcadia,yes,2,2026/02/24 16:00:00+00,yes,0,2026/02/17 20:00:00+00,fc13ced8-e0e7-40aa-b081-eeeba8a0b4bd
-118.249037411241,33.9597388613336,3789,Request Completed,12/03/25,Non-Displacement,2025/10/14 19:12:00+00,"8615 John Avenue, Los Angeles, CA, 90002",PEH next to address 8615 John Ave. ,2,SPA 6,Unincorporated - Florence-Firestone,yes,4,2025/12/16 16:00:00+00,prev_approved_activity_not_required,0,2025/12/03 20:00:00+00,91a32e8f-5060-4e72-806b-57a4f82fa182
-118.181956205615,34.0222398983597,3790,Request Completed,11/21/25,Non-Displacement,2025/10/14 19:31:00+00,"1003 South Bonnie Beach Place, Los Angeles, CA, 90023",Alleyway behind 955 S Bonnie Beach pl,1,SPA 7,Unincorporated - East Los Angeles,yes,2,2025/11/11 16:00:00+00,yes,0,2025/11/21 20:00:00+00,9bf52fa8-86d1-45ca-9368-d503840e113a
-118.189848584287,34.0189464390333,3791,Request Completed,10/16/25,Non-Displacement,2025/10/14 19:46:00+00,"3975 East Olympic Boulevard, Los Angeles, CA, 90023",Olympic blvd from Ditman av to Hicks av,1,SPA 7,Unincorporated - East Los Angeles,yes,2,2025/10/16 22:03:00+00,yes,10,2025/10/16 19:00:00+00,fe4b28e4-848e-42c3-8bf3-6a9a8f72f3d4
-118.232775097807,33.9670602791282,3792,Request Completed,12/16/25,Non-Displacement,2025/10/14 20:29:00+00,"2205 Nadeau St, Huntington Park, CA","PEH next to address 2205 Nadeau St, cross st Alameda. ",2,SPA 6,Unincorporated - Florence-Firestone,yes,2,2025/12/16 16:00:00+00,yes,40,2025/12/16 20:00:00+00,fbb9ceca-c681-4f13-b3e5-ef5d346b7d71
-118.18352460192,34.0312645798752,3793,Request Completed,11/18/25,Non-Displacement,2025/10/14 20:57:00+00,"3909 Eagle St, Los Angeles, CA, 90063",End of culdesac at Eagle st and Herbert av,1,SPA 7,Unincorporated - East Los Angeles,yes,2,2025/11/18 16:00:00+00,yes,20,2025/11/18 20:00:00+00,a4808750-056a-4168-9be1-60426a0f4694
-118.178634780602,34.0341395689984,3794,Request Completed,11/18/25,Non-Displacement,2025/10/14 21:21:00+00,"210 South Sunol Drive, Los Angeles, CA, 90063",Sunol under the overpass,1,SPA 7,Unincorporated - East Los Angeles,yes,4,2025/11/18 16:00:00+00,yes,5,2025/11/18 20:00:00+00,50391a67-d790-456e-90f4-1af37b22abbf
-118.251834457659,33.9239805944323,3795,Request Completed,01/16/26,Full Encampment Protocol,2025/10/15 20:00:00+00,"1305 East 120th St, Los Angeles, CA, 90059",*REPEAT MAINTENANCE CLEANUP* Compton Creek - Main St to South of 120th towards El Segundo.,2,SPA 6,Unincorporated - Willowbrook,no,10,2026/01/14 16:00:00+00,yes,222,2026/01/16 20:00:00+00,f96f461e-256e-4667-8f60-3f46aeab9de9
-118.361829208425,34.1430666947957,3796,Request Completed,10/21/25,Immediate Action,2025/10/16 20:53:00+00,"4067 Lankershim Boulevard, Studio City, CA, 91604","LA River, right (south) bank, upstream (west) of Lankershim Blvd",5,SPA 2,Los Angeles - North Hollywood,yes,3,2025/10/21 15:00:00+00,yes,5,2025/10/21 19:00:00+00,bfaf65b9-c5bd-4568-8019-4255c5d528ee
-118.391688071185,34.1498478940662,3797,Request Completed,,Full Encampment Protocol,2025/10/20 21:01:00+00,"11868 Moorpark St, Studio City, CA, 91604","Tujunga Wash, left (east) bank, downstream (south) of Moorpark St.",5,SPA 2,Los Angeles - Studio City,yes,3,2025/11/03 16:00:00+00,yes,10,2025/11/03 20:00:00+00,e533ed4e-20aa-4281-9712-2add69cf23a7
-118.425268248543,34.018707915011,3798,Request Completed,,Immediate Action,2025/10/21 18:00:00+00,"3448 Sawtelle Boulevard, Los Angeles, CA, 90066","Sawtelle Channel - Sawtelle Blvd and Palms Blvd to Queensland St & Military Ave.   
",3,SPA 5,Los Angeles - Palms,no,5,2025/11/13 16:00:00+00,yes,40,2025/11/13 20:00:00+00,1525c7cc-6ebf-4ebf-8258-7ff32bb43d8e
-118.168252772335,34.0180732266451,3799,Request Completed,11/12/25,Non-Displacement,2025/10/21 19:26:00+00,"1210 South Arizona Avenue, Los Angeles, CA, 90022",Arizona just south of Olympic,1,SPA 7,Unincorporated - East Los Angeles,yes,1,2025/11/18 16:00:00+00,prev_approved_activity_not_required,0,2025/11/12 20:00:00+00,e9201560-fc4e-4b38-971b-fb97a9e47542
-118.179317247225,34.0406281175386,3800,Request Completed,12/16/25,Non-Displacement,2025/10/22 18:52:00+00,"4011 East Cesar E Chavez Avenue, Los Angeles, CA, 90063",Across from 4008 Cesar Chavez. Cross street Hazard av and Cesar Chavez,1,SPA 7,Unincorporated - East Los Angeles,yes,2,2025/12/02 16:00:00+00,prev_approved_activity_not_required,0,2025/12/16 20:00:00+00,0d3113e8-394f-46d6-b6d8-987ae4283893
-118.176094346033,34.0182639197072,3801,Request Completed,11/13/25,Non-Displacement,2025/10/22 19:45:00+00,"4437 Telegraph Road, Los Angeles, CA, 90023",Telegraph from Olympic to Eastern,1,SPA 7,Unincorporated - East Los Angeles,no,8,2025/11/18 16:00:00+00,yes,20,2025/11/13 20:00:00+00,d10fc029-43cf-47b9-bd96-9f20489ec4d9
-118.156612880055,34.0164421910762,3802,Request Completed,12/16/25,Non-Displacement,2025/10/22 20:02:00+00,"1122 South Hillview Avenue, Los Angeles, CA, 90022",S Hillview ave just north of Olympic,1,SPA 7,Unincorporated - East Los Angeles,no,6,2025/12/09 16:00:00+00,yes,1,2025/12/16 20:00:00+00,70e9abf0-f257-4669-ae3d-494c8e3f9083
-118.15624347039,34.0162822822167,3803,Request Completed,12/16/25,Non-Displacement,2025/10/22 20:13:00+00,"1124 South Hillview Avenue, Los Angeles, CA, 90022",Alleyway behind 1125 Goodrich blvd,1,SPA 7,Unincorporated - East Los Angeles,yes,2,2025/12/09 16:00:00+00,yes,2,2025/12/16 20:00:00+00,d68fcdd6-a6f8-4d8d-9d0a-e59da15f67d1
-117.944399079929,34.0498738529147,3804,Approved by CEO-HI,,Non-Displacement,2025/10/22 21:24:00+00,"15603 Alwood St, La Puente, CA, 91744",On Hacienda Bl across from 1731 Hacienda,1,SPA 3,Unincorporated - Valinda,yes,1,2026/03/10 14:55:00+00,,,,3f7dae96-6af4-4481-b381-0c360a7ba4b2
-117.821861111099,34.0316111111076,3805,Request Completed,10/29/25,Immediate Action,2025/10/22 22:26:00+00,"280 Machlin Ct, Walnut, CA, 91789, USA","Encampments are located at San Jose Creek right bank right of way, at MTD 1536, adjacent to 280 Machlin Ct, and are blocking access and maintenance work.",1,SPA 3,City of Pomona,yes,3,,yes,25,2025/10/29 19:00:00+00,6274d6cd-8943-4a39-8da4-f8ed9530a903
-118.547081351262,34.2325957591358,3806,Request Completed,11/06/25,Immediate Action,2025/10/23 19:57:00+00,"19036 Nordhoff St, Los Angeles, CA / behind Vanalden Park ","Wilbur Debris Basin at the confluence of Aliso Creek and Limekiln Channel, near the intersection of Nordhoff St and Vanalden Ave",3,SPA 2,Los Angeles - Northridge,no,9,2025/11/06 16:00:00+00,yes,65,2025/11/06 20:00:00+00,b3d89be4-f6eb-4070-a403-2cc306d30dd8
-118.29731768007,33.8138088723926,3807,Request Completed,12/09/25,Non-Displacement,2025/10/24 20:09:00+00,"23316 Mariposa Ave, Torrance, CA, 90502, USA","23316 Mariposa Ave, several RVs at location but only 3 with debris on the sidewalk. ",2,SPA 8,Unincorporated - West Carson,no,5,2025/12/09 22:35:00+00,yes,20,2025/12/09 20:00:00+00,7d247b2a-d30c-461a-b9e6-7c32f031ee55
-118.219489529825,33.8633846445284,3808,Request Completed,12/09/25,Non-Displacement,2025/10/28 17:21:00+00,"18420 South Laurel Park Road, Compton, CA, 90220",18420 Laurel Park Rd from Victoria St to Rancho Way.,2,SPA 8,Unincorporated - Rancho Dominguez,yes,4,2025/12/09 16:00:00+00,yes,20,2025/12/09 20:00:00+00,760778b5-7f7a-4cf4-afde-efdbfad8c87d
-118.352592903809,33.9399907327522,3809,Request Completed,01/23/26,Non-Displacement,2025/10/28 19:17:00+00,"10600 Hawthorne Boulevard, Inglewood, CA, 90304","10600 Hawthorne Blvd, PEH on 106th St.",2,SPA 8,Unincorporated - Lennox,yes,2,2026/01/23 18:38:00+00,prev_approved_activity_not_required,0,2026/01/23 20:00:00+00,5d780da9-dd47-499b-8651-f551b68a81e9
-118.300064007418,33.9323326529188,3810,Request Completed,01/23/26,Non-Displacement,2025/10/28 20:00:00+00,"11216 South Normandie Avenue, Los Angeles, CA, 90044","11216S Normandie Ave 
PEH between 112th & 113th",2,SPA 8,Unincorporated - Athens-Westmont,yes,2,2026/01/23 18:41:00+00,prev_approved_activity_not_required,0,2026/01/23 20:00:00+00,845ff3f7-2df9-425e-8f46-dd6c20c1918d
-118.509334996661,34.3409909425422,3811,Request Completed,01/23/26,Full Encampment Protocol,2025/10/28 19:53:00+00,"22287 Sierra Hwy Newhall, CA, 91321",Two RV parked on the side of the road Scatter trash everywhere.           ,5,SPA 2,Unincorporated - Angeles National Forest,yes,4,2026/01/23 21:24:00+00,prev_approved_activity_not_required,0,2026/01/23 20:00:00+00,4714124e-5e71-4ce0-a361-1ff4ff443725
-118.308882917411,33.9237635740626,3812,Request Completed,01/23/26,Non-Displacement,2025/10/28 20:17:00+00,"12000 South Western Avenue, Los Angeles, CA, 90047","12000 Western Ave, PEH on 120th side. ",2,SPA 8,Unincorporated - Athens-Westmont,yes,1,2026/01/23 18:46:00+00,prev_approved_activity_not_required,0,2026/01/23 20:00:00+00,15a1279d-0d14-4588-8b09-81a60161cfd9
-118.010955844703,34.0998236265027,3813,Request Completed,11/05/25,Immediate Action,2025/10/28 21:52:00+00,"5401 Peck Road, Arcadia, CA, 91006","*Repeat Maintenance Cleanup* Various Encampments in continuous outreach areas: Peck Park Spreading Grounds, Santa Anita Wash - Live Oak Ave to Peck Park SG. Rio Hondo - 10 Fwy to Peck SG. Arcadia Wash - Lower Azusa. Previously cleaned up on 10/07/2025-10/08/2025.",5,SPA 3,City of Arcadia,yes,4,,yes,46,2025/11/05 20:00:00+00,377363df-0bf0-41dc-8ee4-08a419d2f2f9
-118.073762332644,34.1466004364596,3814,Approved by CEO-HI,,Non-Displacement,2025/10/29 20:28:00+00,"3685 East Colorado Boulevard, Pasadena, CA, 91107",Bus stop on the corner of Colorado bl and Rosemead bl,5,SPA 3,Unincorporated - East Pasadena,yes,2,2026/02/24 16:00:00+00,,,,36758776-be00-48eb-a2fd-6625c196652e
-118.440040451936,34.3170465378182,3815,Request Completed,11/04/25,Immediate Action,2025/10/29 21:07:00+00,"14063 Polk St, Sylmar, CA, 91342","Wilson Canyon Channel, upstream (north) of 210 Polk St. Freeway on-ramp. Encampments are on both banks. ",3,SPA 2,Los Angeles - Sylmar,yes,4,2025/11/04 16:00:00+00,yes,15,2025/11/04 20:00:00+00,77bc2712-08fb-4028-b1dd-7be3e82e2f07
-118.327672585569,33.9007782154751,3816,Request Completed,12/17/25,Immediate Action,2025/10/30 19:50:00+00,"14406 Chadron Avenue, Hawthorne, CA, 90250",Along bike path blocking wheelchair access ramp just west of Rosecrans blvd,2,SPA 8,Unincorporated - El Camino Village,yes,3,,prev_approved_activity_not_required,,2025/12/17 20:00:00+00,e038306d-2379-43cb-bde6-01276974e33c
-117.918916666655,34.106194444441,3817,Request Completed,11/14/25,Immediate Action,2025/10/31 16:56:00+00,"16734 East Arrow Hwy, Covina, CA, 91722","Encampment is located on Little Dalton Wash access road, downstream right bank of Arrow Hwy, and is blocking access and maintenance works.",1,SPA 3,Unincorporated - Covina,yes,1,,yes,2,2025/11/14 20:00:00+00,3c1e8bb2-e0f5-4105-8e8d-7c64c458a394
-117.916999999988,34.1103055555521,3818,Request Completed,11/14/25,Immediate Action,2025/10/31 17:04:00+00,"729 South Lark Ellen Avenue, Azusa, CA, 91702","Encampment is located at Little Dalton Wash access road, upstream left bank of Arrow Hwy, and is blocking access and maintenance works.",1,SPA 3,Unincorporated - Azusa,yes,1,,yes,0,2025/11/14 20:00:00+00,ab91f7dc-729a-402b-8d01-78c8b28bc8fa
-117.975166666653,34.0650555555515,3819,Request Completed,11/14/25,Immediate Action,2025/10/31 17:13:00+00,"1326 Vineland Avenue, Baldwin Park, CA, 91706","Encampment is located on Walnut Creek access road, upstream right bank of Vineland Ave, and is blocking access and maintenance works.",1,SPA 3,City of Baldwin Park,yes,1,,yes,8,2025/11/14 20:00:00+00,1b972b89-b441-4373-8f6f-f941416679f4
-117.98197222221,34.0632222222187,3820,Request Completed,11/14/25,Immediate Action,2025/10/31 17:20:00+00,"1025 North Feather Avenue, La Puente, CA, 91746","Encampment is located on Walnut Creek access road, upstream right bank of Baldwin Park Blvd, and is blocking access and maintenance works.",1,SPA 3,City of Baldwin Park,yes,1,,yes,0,2025/11/14 20:00:00+00,0c94d5a4-a140-48b2-8d07-0b41cd1cecc2
-118.108164734497,33.9019826958524,3821,Approved by CEO-HI,,Full Encampment Protocol,2025/10/31 22:31:00+00,"10600 Rosecrans Avenue, Norwalk, CA",San Gabriel River from Firestone Blvd to 183rd St Invert and ROW.,4,SPA 7,City of Bellflower,no,16,2026/02/25 16:00:00+00,,,,dc0f7a06-1a33-4f56-80f5-bfed6bb35882
-118.073793929124,33.8327155671106,3822,Request Completed,01/07/26,Full Encampment Protocol,2025/10/31 22:43:00+00,"12029 E Carson St, Hawaiian Gardens, CA, 90716, USA",BI 021 @ Carson St W/S ROW in Hawaiian Gardens,4,SPA 7,City of Hawaiian Gardens,yes,3,2026/01/07 16:00:00+00,yes,25,2026/01/07 20:00:00+00,8dbe678d-b3db-4bb8-8e80-2ca14601eb36
-118.367995192115,34.1458403794339,3823,Request Completed,11/06/25,Immediate Action,2025/11/03 15:33:00+00,"4294 Vineland Avenue, North Hollywood, CA, 91602","Tujunga Central Channel, left (east) bank, downstream (south) of Vineland Ave.",5,SPA 2,Los Angeles - Studio City,yes,3,2025/11/05 16:00:00+00,yes,5,2025/11/06 20:00:00+00,9bbc3ab4-f7b7-4757-a3ae-893ffd7d2637
-118.450600592479,34.1580262793339,3824,Request Completed,11/06/25,Immediate Action,2025/11/03 23:16:00+00,"14548 La Maida St, Sherman Oaks, CA, 91403","L.A. River, right bank, downstream of Kester Ave.",3,SPA 2,Los Angeles - Sherman Oaks,yes,4,2025/11/06 16:00:00+00,yes,10,2025/11/06 20:00:00+00,ebaacb57-9815-442b-a17e-25a83d37b3fb
-118.028841302005,34.0393186964367,3825,Request Completed,11/13/25,Immediate Action,2025/11/04 21:21:00+00,"11526 Thienes Avenue, South El Monte, CA, 91733","*Repeat Maintenance Cleanup* San Gabriel River - San Jose Creek Confluence to Valley Blvd. Soft Bottom Invert, outlets, and embankment encampments are at high risk of flooding and are also obstructing vegetation clearing maintenance work. Access road encampments blocking emergency and maintenance vehicular access. Previously cleaned up on 10/14-10/15/25.",1,SPA 3,City of South El Monte,no,10,,yes,74,2025/11/13 20:00:00+00,ce850952-aaca-4df0-8a45-953c77f12e4e
-118.17235900085,33.9421826045196,3826,Request Completed,12/15/25,Full Encampment Protocol,2025/11/05 18:22:00+00,"10001 West Frontage Road, South Gate, CA, 90280","DDI 0023 - LA River - Rio Hondo Channel (East and West Sides)
From Firestone Blvd to Imperial Hwy and to Garfield Ave overcrossing Rio Hondo Channel.",4,SPA 7,City of South Gate,no,12,2025/12/10 20:00:00+00,yes,537,2025/12/15 20:00:00+00,ce852aea-edb4-4ec4-833e-7660f2393e19
-118.185830237424,34.0402778377987,3827,Request Completed,12/02/25,Non-Displacement,2025/11/06 00:37:00+00,"3630 East Cesar E Chavez Avenue, Los Angeles, CA, 90063",3700 E Cesar Chavez Ave cross St Eastman Ave. PEH on Eastman Ave side.,1,SPA 7,Unincorporated - East Los Angeles,yes,1,2025/12/02 16:00:00+00,yes,10,2025/12/02 20:00:00+00,58768af2-6a9c-4220-863a-2049479c6676
-118.151364293828,34.0302448668543,3828,Request Completed,12/10/25,Non-Displacement,2025/11/06 18:55:00+00,"5300 East Beverly Boulevard, Los Angeles, CA, 90022",Alleyway on Hillview just East of Beverly,1,SPA 7,Unincorporated - East Los Angeles,yes,2,2025/12/09 16:00:00+00,yes,5,2025/12/10 20:00:00+00,0f46b26c-236f-4258-ab53-705c906890fc
-118.282294076459,33.9143041056542,3829,Approved by CEO-HI,,Non-Displacement,2025/11/06 20:50:00+00,"416 West 130th St, Los Angeles, CA, 90061",Alley next to 416 w 130th St. ,2,SPA 8,Los Angeles - Harbor Gateway,yes,2,,,,,4f90d7b8-23cc-45af-8258-b1054954d40e
-117.904330637831,33.9930695985829,3830,Request Completed,11/14/25,Immediate Action,2025/10/14 16:20:00+00,"1400 Felicia Avenue, Rowland Heights, CA, 91748","*Repeat Maintenance Cleanup*
Encampment and debris in underground portion of Vernon Channel. In danger of storm season flooding. Adjacent to Shopping Center at 1330 Fullerton Rd, also underneath Colima Rd. Previously cleaned on 10/29/25.",1,SPA 3,City of Industry,yes,2,,yes,15,2025/11/14 20:00:00+00,480b8749-2830-4d74-8ea8-955d1362b7eb
-118.390288703098,33.9790882300905,3831,Request Completed,12/10/25,Immediate Action,2025/11/07 21:00:00+00,"6001 West Centinela Avenue Los Angeles, CA, 90045","Centinela Ave to Culver Blvd
",2,SPA 5,City of Culver City,no,8,2025/12/10 16:00:00+00,yes,50,2025/12/10 20:00:00+00,f6f73b01-006f-4502-848b-cb04bc406991
-118.564427373629,34.2356165403719,3832,Request Completed,11/21/25,Immediate Action,2025/11/12 17:11:27.620+00,"19801 Nordhoff Place, Chatsworth, CA, 91311","Limekiln Creek, left (east) bank, upstream (north) of Nordhoff Place in front of access gate",3,SPA 2,Los Angeles - Northridge,yes,2,2025/11/21 16:00:00+00,yes,1,2025/11/21 20:00:00+00,0fae5033-06f3-49cd-bdd0-d8d3141a4eea
-118.083527777766,34.1379166666632,3833,Request Completed,11/26/25,Immediate Action,2025/11/13 18:18:00+00,"3217 San Pasqual St, Pasadena, CA, 91107","Encampments are located on Eaton Wash access road, upstream right bank of San Pasqual St, and are blocking access and maintenance works.",5,SPA 3,Unincorporated - East Pasadena,yes,2,,yes,9,2025/11/26 20:00:00+00,b1830332-bf35-44aa-82d7-d0b8dbfcd26c
-118.081027777764,34.1299722222182,3834,Request Completed,11/26/25,Immediate Action,2025/11/13 18:30:00+00,"3425 Huntington Drive, Pasadena, CA, 91107","Encampments are located on Eaton Wash access road, upstream right bank of Huntington Dr, and are obstructing routine maintenance works.",5,SPA 3,Unincorporated - East Pasadena,yes,2,,yes,20,2025/11/26 20:00:00+00,5e27ca31-7da4-478e-84a8-7d0e74bc9d5b
-118.154702641985,34.018970289966,3835,Request Completed,12/09/25,Non-Displacement,2025/11/13 19:08:00+00,"5378 Louis Place, Los Angeles, CA, 90022",Alley behind 5378 Louis Pl,1,SPA 7,Unincorporated - East Los Angeles,yes,2,2025/12/09 20:30:00+00,yes,20,2025/12/09 20:00:00+00,574ffb43-fd3d-4ac2-8295-cccfa33dd964
-118.041345076796,33.9007556312734,3836,Request Completed,01/16/26,Immediate Action,2025/11/14 15:50:00+00,"13700 Milroy Place, Santa Fe Springs, CA, 90670","*Repeat Maintenance Cleanup* Coyote Creek & CC - North Fork Channel from Leffingwell Rd. to Carson St.
Last Cleanup: 09/02/25 - 09/04/25; 10/15/25 - 10/20/25",4,SPA 7,City of Santa Fe Springs,no,20,2026/01/13 16:00:00+00,yes,530,2026/01/16 20:00:00+00,455b0f4f-7ad3-40c3-8c35-1c6788a269fc
-118.239917401319,33.9881605888056,3837,Approved by CEO-HI,,Non-Displacement,2025/11/14 18:57:00+00,"1839 East 58th Place, Los Angeles, CA, 90001",1843 E 58th Pl,2,SPA 7,Unincorporated - Florence-Firestone,yes,2,2026/03/03 16:00:00+00,no,,,0bd4ec61-4ecc-4e7d-a745-6a850bc87125
-118.254058701007,33.9607051498525,3839,Request Completed,11/20/25,Non-Displacement,2025/11/14 20:44:00+00,"1157 Firestone Boulevard, Los Angeles, CA","1157 Firestone Blvd, cross st Hooper Av. ",2,SPA 6,Unincorporated - Florence-Firestone,no,10,2025/11/20 23:00:00+00,yes,40,2025/11/20 20:00:00+00,0ea94f14-c3a9-44b6-aea3-aebf9ed98198
-118.25498937553,33.9600928994901,3840,Request Completed,11/17/25,Non-Displacement,2025/11/14 20:56:00+00,"1134 Firestone Boulevard, Los Angeles, CA",1134 Firestone Blvd. Cross st Hooper. ,2,SPA 6,Unincorporated - Florence-Firestone,no,6,2025/11/17 23:15:00+00,yes,40,2025/11/17 20:00:00+00,3adc8ad6-827f-4330-afbf-318bf11d18ef
-118.177855024208,34.0192665858465,3841,Request Completed,12/09/25,Non-Displacement,2025/11/14 21:05:00+00,"4373 Telegraph Road, Los Angeles, CA, 90023",Olympic just west of Telegraph and Telegraph from Downey to Olympic,1,SPA 7,Unincorporated - East Los Angeles,yes,4,2025/12/09 16:00:00+00,yes,5,2025/12/09 20:00:00+00,ce7cb1f9-885d-4b06-b088-a456bee540df
-118.073229156237,34.1466128668687,3842,Request Completed,02/17/26,Immediate Action,2025/11/15 16:55:00+00,"3701 East Colorado Boulevard, Pasadena, CA, 91107"," 3701 E Colorado Blvd Pasadena, CA  91107 
On the Rosemead ",5,SPA 3,Unincorporated - East Pasadena,yes,1,2026/02/24 16:00:00+00,yes,0,2026/02/17 20:00:00+00,614ee6fd-85a1-43ab-bf10-9d38152cf509
-118.246402981633,33.9293670460175,3843,Approved by CEO-HI,,Non-Displacement,2025/11/04 16:00:00+00,"11519 South Compton Avenue, Los Angeles, CA, 90059",Compton Ave and Imperial Hwy under the 105 Fwy.,2,SPA 6,Unincorporated - Willowbrook,no,5,2026/03/03 16:00:00+00,no,,,02a75cd3-6826-493c-8971-bc27ae21db7e
